title,release_year,description,type,rating,runtime,imdb_rating,genre,director,stars,gross
Christmas at Graceland: Home for the Holidays,2019.0,"Harper is in Memphis before Christmas, visiting her sister and family after 3 years working at museums in Europe. Visiting Graceland with her 2 nieces, Harper meets a single dad of 3 kids and is offered a job as nanny temp.",Movie,TV-G,84.0,6.3,"Music, Romance",Eric Close,"Kaitlin Doubleday, Adrian Grenier, Sunny Mabrey, Alan Wells, ",
'Twas the Night,2001.0,A mischievous 14-year-old boy and his irresponsible uncle almost ruin Christmas when they decide to take Santa's new high-tech sleigh for a joyride.,Movie,TV-G,84.0,5.2,"Comedy, Family",Nick Castle,"Josh Zuckerman, Brenda Grate, Bryan Cranston, Jefferson Mappin, ",
Christmas on Mistletoe Lake,2022.0,"Interior designer Reilly finds herself this Christmas in the town of Mistletoe Lake with no place to stay. She accepts an offer from Ray to stay in his boat, helping him renovate the boat for the town's Christmas Harbor Festival.",Movie,TV-PG,87.0,5.4,"Comedy, Romance",Robin Dunne,"Genelle Williams, Corey Sevier, Hattie Kragten, Brandon Ludwig, ",
Much Ado About Christmas,2021.0,"A modern-day re-imagining of William Shakespeare's play ""Much Ado About Nothing,"" set at Christmastime.",Movie,7+,85.0,6.8,"Drama, Family, Fantasy",Michael Damian,"Susie Abromeit, Torrance Coombs, James Rottger, Emma Colling, ",
Time for Me to Come Home for Christmas,2018.0,"When strangers Cara and Heath are stranded before Christmas, they embark on an unexpected journey that may give them the miracles they've been hoping for.",Movie,TV-G,84.0,6.6,"Comedy, Drama, Music",David Winning,"Josh Henderson, Megan Park, Lindsay Maxwell, Paul McGillion, ",
A Christmas to Remember,2016.0,"Following a car accident which leaves her with a bout of amnesia, a celebrity chef gets stranded in a small town over the Christmas season.",Movie,TV-G,84.0,6.5,"Comedy, Drama, Romance",David Weaver,"Mira Sorvino, Cameron Mathison, Jesse Filkow, Bailey Skodje, ",
Kirk Franklin's A Gospel Christmas,2021.0,"Follows Olivia, a young assistant pastor, as she deals with the transition to be lead pastor at a new church a month before Christmas, and finds a little romance along the way.",Movie,TV-G,87.0,6.4,"Drama, Musical, Romance",Erica C. Sutherlin,"Demetria McKinney, Chaz Lamar Shepherd, Angela Birchett, Kendra C. Johnson, ",
Naughty & Nice,2014.0,"A cynical radio host is banished to Colorado, where he has an on-air spat with a hopeless romantic. Soon, their antagonistic relationship sparks the interest of the whole town.",Movie,TV-PG,88.0,5.9,"Comedy, Romance",Sam Irvin,"Haylie Duff, Tilky Jones, Maureen McCormick, Eric Petersen, ",
Making Spirits Bright,2021.0,Grace and Tony are from two separate families who are in the business of decorating homes for Christmas. Unfortunately they have also been in feud for as long as anyone can remember. But ...                See full summary »,Movie,TV-G,84.0,6.1,"Drama, Romance",David Bercovici-Artieda,"Taylor Cole, Carlo Marks, Sarah Surh, John Cassini, ",
A Christmas in Tennessee,2018.0,A real estate development consultant attempts to sweet-talk the owner of a small town bakery shop into selling her property.,Movie,TV-PG,87.0,6.7,"Comedy, Drama, Romance",Gary Yates,"Rachel Boston, Andrew W. Walker, Patricia Richardson, Kate Moyer, ",
The Christmas Note,2015.0,"After moving into a new house, a woman befriends her next-door neighbor and helps her track down a mystery sibling she never knew she had.",Movie,Not Rated,85.0,6.7,"Drama, Mystery",Terry Ingram,"Jamie-Lynn Sigler, Leah Gibson, Lynda Boyd, Dylan Kingwell, ",
Picture a Perfect Christmas,2019.0,A professional photographer returns home for Christmas to visit her grandmother and is hired as a nanny for the young nephew of their next-door-neighbor.,Movie,TV-G,84.0,6.9,"Comedy, Drama, Romance",Paul Ziller,"Merritt Patterson, Jon Cor, Luke Roessler, Paula Shaw, ",
Christmas at Rosemont,2015.0,"In a raging blizzard five days before Christmas, two young people meet by chance: Lisa, 19, pregnant and scared; and Brad, a professional snowboarder. Both want to make it over the ...                See full summary »",Movie,TV-14,95.0,6.6,Drama,Daniel Petrie Jr.,"Brad Dourif, Lauren Swickard, Lochlyn Munro, Michael Gross, ",
A Royal Christmas Ball,2017.0,A bachelor king tries to reconnect with his old college sweetheart.,Movie,TV-PG,86.0,4.6,"Drama, Romance",David DeCoteau,"Tara Reid, Ingo Rademacher, Haley Pullos, Mira Furlan, ",
Miracle on 34th Street,1973.0,"A department store Santa tries to convince a little girl who doesn't believe in Santa Claus that he is Santa Claus, and winds up going on trial to prove who he is.",Movie,,100.0,5.8,"Drama, Family, Fantasy",Fielder Cook,"Sebastian Cabot, Jane Alexander, David Hartman, Suzanne Davidson, ",
A Godwink Christmas: Miracle of Love,2021.0,"Brought together by community service, Eric and Joy find new purpose at Christmas. As they help a family rebuild their home, coincidences and a medical miracle lead them to believe in destiny.",Movie,TV-G,84.0,6.2,"Comedy, Drama, Romance",Heather Hawthorn Doyle,"Katherine Barrell, Alberto Frezza, Josh Ssettuba, Faith Wright, ",
Nagykarácsony,2021.0,A firefighter develops a fear of heights and has strange visions after his wedding proposal goes up in smoke.Will a teacher he meets later cure his vertigo and mend his broken heart?,Movie,,110.0,6.3,"Comedy, Romance",Dániel Tiszeker,"András Ötvös, Emöke Zsigmond, Péter Scherer, Lia Pokorny, ",
Christmas in Love,2018.0,An aspiring crafter working in her small town's bakery shows the new big-city CEO that it's people and not machines which make the business a success.,Movie,TV-G,84.0,6.3,"Drama, Romance",Don McBrearty,"Brooke D'Orsay, Daniel Lissing, Mary-Margaret Humes, David Keeley, ",
Fixing Up Christmas,2021.0,"Known as a ""fixer"" for difficult clients, a talented party planner must help a young CEO plan the Christmas party of the year to dazzle the mayor and save his company. Wil the ""fixer"" fix something more than just the company?",Movie,AL,85.0,5.9,"Comedy, Romance",Jessica Harmon,"Natalie Dreyfuss, Marshall Williams, Harrison Coe, Bethany Brown, ",
Project Christmas Wish,2020.0,"For years Lucy has played Santa in her small-town community. As she grants a little girl's wish for a ""Christmas like it used to be,"" she unexpectedly finds her own wishes coming true.",Movie,TV-G,85.0,6.9,"Drama, Family, Romance",Jeff Beesley,"Amanda Schull, Travis Van Winkle, Averie Peters, Amy Groening, ",
A Very Charming Christmas Town,2020.0,A lifestyle blogger is assigned to write a news story on a small tourist town for the Christmas season.,Movie,TV-PG,88.0,5.9,"Comedy, Drama, Romance",Jake Helgren,"Natalie Hall, Jon Prescott, Kelley Jakle, Jo Marie Payton, ",
The Last Christmas Home,2018.0,The Marvin sisters gather for what may be their last Christmas at their childhood home.,Movie,TV-G,82.0,5.8,"Drama, Family, Romance",David Jackson,"Erin Cahill, Justin Bruening, Catherine Corcoran, Alan Pontes, ",
A Dickens of a Holiday!,2021.0,"To make the 100th anniversary of her hometown's Victorian festival a success, Cassie invites action movie star and former high school classmate Jake to play in ""A Christmas Carol.""",Movie,AL,84.0,7.3,Romance,Paul Ziller,"Brooke D'Orsay, Kristoffer Polaha, Chad Willett, Max Archibald, ",
A Royal Queens Christmas,2021.0,A prince finds his way to Queens during Christmas when a local woman enlists his help with a children's Christmas show.,Movie,TV-G,84.0,6.4,"Drama, Romance",Lee Friedlander,"Megan Park, Julian Morris, Michael Hanrahan, Nicola Correia-Damude, ",
A Very Corgi Christmas,2019.0,"Single dad Ben needs help to keep a Christmas gift a secret from his daughter, and that gift is an adorable Corgi puppy! When he meets single mom Lauren he shows her the importance of family and spending time with the people you love.",Movie,,90.0,5.3,"Drama, Family, Romance",Andrew Cymek,"Kelly Kruger, Kevin McGarry, Davide Fair, Ariella Cannon, ",
Christmas in Toyland,2022.0,A toy company data analyst tries to save hundreds of jobs right before Christmas to help keep the in-person experience alive.,Movie,,85.0,6.4,"Comedy, Romance",Bill Corcoran,"Vanessa Lengies, Jesse Hutch, Lara Amersey, Elena V. Wolfe, ",
Northpole,2014.0,"An injured figure skater is sent to the mountains to recover from an injury. Once there, she meets an ex-hockey player and his young daughter and begins to realize that something is missing from her life.",Movie,G,81.0,6.3,"Family, Fantasy, Romance",Douglas Barr,"Tiffani Thiessen, Josh Hopkins, Bailee Madison, Max Charles, ",
A Taste of Christmas,2017.0,"When Emily, a struggling baker in a small town, receives a handmade Christmas Calendar from a secret admirer, the local residents become obsessed with finding out the identity of the sender.",Movie,Unrated,84.0,5.9,"Comedy, Mystery, Romance",Allan Harmon,"Laura Bell Bundy, Brendon Zub, Paloma Kwiatkowski, Frazey Ford, ",
Christmas in Paris,2019.0,"Lucas, a wealthy French entrepreneur, heads to Montana for a very attractive business proposal. When there he meets Robin, falls in love, and whisks her away to Paris on a whirlwind ...                See full summary »",Movie,G,90.0,5.1,"Drama, Romance",Justin G. Dyck,"Rebecca Dalton, Karl E. Landler, Daphne Zuniga, Andrew Jackson, ",
Cranberry Christmas,2020.0,A separated couple feign marital bliss on national television to help their town's Christmas festival and their business. But what will the future hold for them when rekindled love is complicated by new opportunities.,Movie,,84.0,6.5,"Comedy, Drama, Romance",Linda-Lisa Hayter,"Nikki Deloach, Benjamin Ayres, Marci T. House, Erin Boyes, ",
Let It Snow,2013.0,An executive examines her company's new property and prepares a presentation to transform the rustic lodge into a new hot spot.,Movie,TV-G,82.0,6.6,"Drama, Family, Romance",Harvey Frost,"Candace Cameron Bure, Jesse Hutch, Alan Thicke, Gabrielle Rose, ",
A Twist of Christmas,2018.0,"In the shopping frenzy before Christmas at a busy department store, two single parents are each left with the wrong gifts for their respective children after their bags get accidentally switched.",Movie,TV-PG,87.0,6.4,"Family, Romance",David Winning,"Vanessa Lachey, Brendon Zub, Rick Fox, Christian Convery, ",
Christmas Ever After,2020.0,Sparks fly during Christmastime when a romance novelist meets a handsome man who looks like the leading character in her books.,Movie,TV-G,87.0,6.1,"Drama, Romance",Pat Kiely,"Ali Stroker, Daniel di Tomasso, Bill Marchant, Melia Charlotte Cressaty, ",
Holly & Ivy,2020.0,A contractor helps a woman renovate a house so she can adopt a sick neighbor's two children.,Movie,TV-G,85.0,7.1,"Drama, Family, Romance",Erica Dunton,"Janel Parrish, Jeremy Jordan, Marisol Nichols, Sadie Coleman, ",
A Wish For Christmas,2016.0,"Sara Thomas is the type of woman who prefers to sit on the sidelines at work, but when her big idea for a Christmas initiative is stolen, she makes a wish to Santa that she'll finally have ...                See full summary »",Movie,TV-G,84.0,5.9,"Drama, Family, Fantasy",Christie Will Wolf,"Lacey Chabert, Paul Greene, Andrea Brooks, Colleen Wheeler, ",
A Bramble House Christmas,2017.0,"Finn Conrad becomes suspicious as to why his father left a nurse, named Willa $100,000, and goes undercover to investigate. When she discovers his true identity, will it keep her from ever trusting him again?",Movie,Not Rated,84.0,7.1,"Drama, Romance",Steven R. Monroe,"Autumn Reeser, David Haydn-Jones, Liam Hughes, Teryl Rothery, ",
A Holiday for Love,1996.0,"A man is sent to a small town to assess which of the workers in the local factory that supplies the town with jobs should get the boot when the downsizing begins. He gets sidetracked when he falls in love with a local, a cute single mom.",Movie,AL,105.0,6.4,"Drama, Family, Romance",Jerry London,"Tim Matheson, Melissa Gilbert, Michelle Trachtenberg, Jayne Eastwood, ",
A Boyfriend for Christmas,2004.0,"On Christmas Day, Santa brings two lonely people together. But can love overcome deception?",Movie,TV-G,94.0,6.4,"Comedy, Drama, Family",Kevin Connor,"Kelli Williams, Patrick Muldoon, Charles Durning, Bruce Thomas, ",
Love at the Christmas Contest,2022.0,"A young woman enters a Christmas tree decorating contest to honor the memory of her mother, only to discover that the competition includes her recently-widowered high school sweetheart, and his adorable 10-year-old daughter.",Movie,,90.0,5.7,"Comedy, Romance",John Burd,"Samantha Cope, Ross Jirgl, James Healy Jr., Triana Browne, ",
The Christmas Project,2016.0,"A writer looks back on his memorable 1986 Christmas, dealing with brothers, bullies, first love, pregnancy and family ""elving.""",Movie,TV-PG,92.0,5.5,"Comedy, Family",Michael Buster,"Jacob Buster, Anson Bagley, Josh Reid, Cooper Johnson, ",
Christmas Cookies,2016.0,"A corporate agent is sent to a small town to buy a cookie company and shut down its factory. When she starts falling in love with the factory's owner, the town's Christmas spirit over takes her.",Movie,TV-G,84.0,6.4,"Drama, Romance",James Head,"Jill Wagner, Wes Brown, P. Lynn Johnson, Chris Gauthier, ",
Switched for Christmas,2017.0,"When identical twin sisters are stuck planning their respective Christmas parties, they're convinced the grass is greener on the other side and decide to swap lives for the holidays.",Movie,TV-G,83.0,6.6,"Comedy, Drama, Family",Lee Friedlander,"Candace Cameron Bure, Eion Bailey, Mark Deklin, Natasha Bure, ",
The Christmas Box,1995.0,"A ski-shop owner reluctantly moves himself, his wife, and his daughter in to an estate as live-in help for an elderly widow. While struggling to balance his career and family life, he has recurring dreams about an angel.",Movie,G,100.0,6.9,"Drama, Fantasy",Marcus Cole,"Richard Thomas, Maureen O'Hara, Annette O'Toole, Kelsey Mulrooney, ",
Good Morning Christmas!,2020.0,"Two squabbling TV hosts are sent to a festive small town over Christmas. While pretending to get along for the sake of appearances, they discover there's more to each other than they thought.",Movie,TV-G,84.0,6.9,"Drama, Romance",Paul Ziller,"Alison Sweeney, Marc Blucas, Nicole Oliver, Matthew James Dowden, ",
Angel of Christmas,2015.0,"After she finally gets the chance to pen her very first article, an aspiring newspaper writer digs into her family history to find the perfect Christmas story.",Movie,TV-G,84.0,6.2,"Comedy, Romance",Ron Oliver,"Jennifer Finnigan, Jonathan Scarfe, Holly Robinson Peete, Christie Laing, ",
The Lemon Drop Kid,1951.0,"A New York City swindler has until Christmas to come up with the $10,000 he owes a gangster, prompting him to go into scamming overdrive.",Movie,Approved,91.0,7.0,"Comedy, Crime, Music",Sidney Lanfield,"Frank Tashlin, Bob Hope, Marilyn Maxwell, Lloyd Nolan, Jane Darwell, ",
A Puppy for Christmas,2016.0,"After adopting a cute puppy, Noelle's world is turned upside down when her boyfriend breaks up with her. After accepting an invitation to spend the holidays with a co-worker, she is ...                See full summary »",Movie,TV-PG,85.0,5.9,"Comedy, Drama, Romance",Justin G. Dyck,"Cindy Busby, Greyston Holt, Christopher Russell, Allison Price, ",
A Perfect Christmas,2016.0,"A newlywed couple prepare to host their first family Christmas together, but things don't go according to plan.",Movie,TV-G,84.0,6.1,"Comedy, Family, Romance",Brian K. Roberts,"Susie Abromeit, Dillon Casey, Erin Gray, Neil Crone, ",
Spotlight on Christmas,2020.0,"Dumped before Christmas, famous Hollywood actress Olivia secretly returns to her hometown to eat cookies and avoid the press. Instead, she has to step up to take the starring role in her own life, realizing that home is where the heart is.",Movie,TV-PG,84.0,6.1,"Drama, Romance",Ali Liebert,"Tori Anderson, Victor Zinck Jr., Lia Frankland, Janet Kidder, ",
The Santa Suit,2010.0,"Hunter Toys CEO Drake Hunter turned his father's company from a cozy quality manufacturer into a ruthless, profitable business. After denying his staff any further festive generosity, the ...                See full summary »",Movie,TV-G,89.0,6.5,"Adventure, Comedy, Family",Robert Vaughn,"Kevin Sorbo, Jodie Dowdall, Derry Robinson, Rosemary Dunsmore, ",
Snow,2004.0,"Set in San Ernesto, California with only three days before Christmas, Nick Snowden needs to rescue a young reindeer from a zoo.",Movie,,120.0,6.4,"Comedy, Family, Fantasy",Alex Zamm,"Tom Cavanagh, Ashley Williams, Patrick Fabian, Bobb'e J. Thompson, ",
Christmas Eve on Sesame Street,1978.0,"Big Bird worries when Oscar tells him that if Santa Claus can't fit down the chimney on Christmas Eve, nobody would get presents.",Movie,TV-Y,60.0,8.4,"Comedy, Family, Music",Jon Stone,"Jim Henson, Frank Oz, Jerry Nelson, Richard Hunt, ",
The Twelve Days of Christmas Eve,2004.0,"A successful CEO meets a Latin American rep Christmas Eve. He thus neglects girlfriend, family and employees and the day magically repeats itself until he gets it right.",Movie,PG,85.0,5.7,"Comedy, Drama, Fantasy",Martha Coolidge,"Steven Weber, Stefanie von Pfetten, Mark Krysko, Teryl Rothery, ",
The Enchanted Christmas Cake,2021.0,"Gwen recently lost her grandmother and she is struggling to run their bakery and regain the Christmas spirit, and figure out her grandmother's magical recipe for the town's legendary Enchanted Christmas Cake.",Movie,,90.0,5.4,Romance,Robert Vaughn,"Erica Durance, Robin Dunne, Kyana Teresa, Paulino Nunes, ",
Never Kiss a Man in a Christmas Sweater,2020.0,Maggie is facing Christmas alone until Lucas become an unexpected house guest.,Movie,TV-G,84.0,6.7,"Comedy, Romance",Allan Harmon,"Ashley Williams, Niall Matter, Lisa MacFadden, Brendon Zub, ",
Dashing in December,2020.0,"When Wyatt Burwall finally returns home for the holidays in an effort to convince his mother Deb to sell the family's Colorado ranch, a romance unexpectedly ignites between Wyatt and their ...                See full summary »",Movie,TV-14,88.0,6.2,"Drama, Romance",Jake Helgren,"Peter Porte, Juan Pablo Di Pace, Andie MacDowell, Caroline Harris, ",
"Pride, Prejudice and Mistletoe",2018.0,"Darcy is a career woman who hasn't found love, but her life turns upside down when she returns home to help her mother plan a charity event.",Movie,TV-PG,82.0,6.2,Romance,Don McBrearty,"Lacey Chabert, Brendan Penny, Sherry Miller, Art Hindle, ",
Christmas Child,2004.0,A life-sized nativity leads a man to learn about his past and lost family.,Movie,Not Rated,96.0,6.2,Drama,Bill Ewing,"Bart Gavigan, William R. Moses, Tonya Bordeaux, Steven Curtis Chapman, Megan Follows, ",
A Blue Ridge Mountain Christmas,2019.0,"Hotel manager Willow returns to her stunning Virginia hometown to help her sister plan a Christmas wedding at the inn her family once owned. She must work with current owner and single dad David, who wants to let go of the past.",Movie,TV-G,84.0,6.1,Family,David Winning,"Rachael Leigh Cook, Benjamin Ayres, Christie Burke, Chilton Crane, ",
Cherished Memories: A Gift to Remember 2,2019.0,"As Darcy and Aiden prepare to celebrate their second Christmas together, an unexpected guest and a fight to save the beloved community center unites everyone for an unforgettable holiday.",Movie,TV-G,86.0,6.1,"Comedy, Drama, Family",Kevin Fair,"Peter Porte, Ali Liebert, Tina Lifford, Dominic Mariche, ",
Angels and Ornaments,2014.0,Three suitors pursue a hopeless romantic after she makes a wish to find true love before Christmas,Movie,TV-G,84.0,6.8,"Family, Fantasy, Romance",Alan Goluboff,"Jessalyn Gilsig, Sergio Di Zio, Graham Abbey, Roger Doche, ",
"It's Christmas, Eve",2018.0,"An interim school superintendent finds herself in a tough spot when she is assigned to shut down a school's failing music program, and must come to terms with her musical past.",Movie,TV-G,84.0,6.5,"Drama, Music, Romance",Tibor Takács,"LeAnn Rimes, Tyler Hynes, Gwynyth Walsh, Laurie Murdoch, ",
Saving Santa,2013.0,"A lowly stable elf finds that he is the only one who can stop an invasion of the North Pole by using the secret of Santa's Sleigh, a TimeGlobe, to travel back in time to Save Santa, twice.",Movie,Not Rated,83.0,5.3,"Animation, Adventure, Comedy",Leon Joosen,"Aaron Seelman, Newell Alexander, Noel Clarke, Joan Collins, Tim Conway, ",
Star in the Night,1945.0,"Three cowboys riding across the desert with gifts for no particular recipient, see a distant bright light and find it comes from the Star Auto Court sign where the owners and guests work together to help a young pregnant wife and husband.",Movie,Not Rated,22.0,7.7,"Short, Drama, Family",Don Siegel,"J. Carrol Naish, Donald Woods, Rosina Galli, Richard Erdman, ",
Silver Bells,2005.0,"Manhattanite Catherine O'Mara (Heche) bonds with a young man who has run away from his father. When the father returns to New York a year later to sell his Christmas trees, he and Catherine cross paths.",Movie,TV-G,95.0,6.4,"Drama, Family, Romance",Dick Lowry,"Anne Heche, Tate Donovan, Michael Mitchell, Courtney Jines, ",
Snowmance,2017.0,"Each year Sarah builds her ""Snow Beau"" snowman with her best friend Nick. After another breakup, she begins to wonder if she'll ever find her own true love. A little Christmas magic brings her Snow Beau to life.",Movie,Unrated,90.0,5.2,"Comedy, Drama, Family",Douglas Mitchell,"Ashley Newbrough, Jesse Hutch, Adam Hurtig, Tom Anniko, ",
A Dennis the Menace Christmas,2007.0,"To make sure that his beloved neighbour, Mr Wilson, has the perfect Christmas, the neighbourhood's lively six-year-old boy, Dennis Mitchell, makes a long list of things one needs to make it work. However, is Mr Wilson willing to change?",Movie,G,83.0,4.7,"Comedy, Family, Fantasy",Ron Oliver,"Maxwell Perry Cotton, Robert Wagner, Louise Fletcher, Isaac Durnford, ",
A Christmas Kiss II,2014.0,"At a Christmastime event, Jenna shares an impromptu, unforgettable kiss with the dashing billionaire, Cooper Montgomery. Unaware of his intentions and fearful of getting hurt in another ...                See full summary »",Movie,Unrated,88.0,5.9,"Comedy, Romance",Kevin Connor,"Elisabeth Harnois, Adam Mayfield, Jonathan Bennett, Lola Glaudini, ",
The Christmas Bow,2020.0,"When an accident puts her music dreams on hold, a gifted violinist reconnects with an old family friend who helps her heal and find love during the holidays.",Movie,TV-G,83.0,6.7,"Drama, Music, Romance",Clare Niederpruem,"Lucia Micarelli, Michael Rady, James Saito, Joy Perry, ",
Journey Back to Christmas,2016.0,A WWII-era nurse is transported in time to 2016 and meets a man who helps her discover the bonds of family and that the true meaning of Christmas is timeless.,Movie,TV-G,84.0,7.0,"Drama, Family, Fantasy",Mel Damski,"Candace Cameron Bure, Oliver Hudson, Brooke Nevin, Meghan Heffern, ",
Once Upon a Main Street,2020.0,"Amelia, who wants to open a year-round Christmas store, bids for a shop lot against Vic, who wants to open a chocolate shop. Rivalry becomes romance when they must work together.",Movie,TV-PG,87.0,6.3,"Comedy, Drama, Romance",Polly Draper,"Vanessa Lachey, Ryan McPartlin, Polly Draper, Scott Takeda, ",
Christmas on the Rocks,2022.0,"When an event planner is hurt, her twin sister pretends to be her to save an important corporate client, but things go awry when an old flame reappears and the twin is still stuck pretending to be her sister.",Movie,,90.0,6.4,Romance,Lane Shefter Bishop,"Khiyla Aynne, Bukola Ayoka, Matthew Bennett, Billy MacLellan, ",
Christmas Around the Corner,2018.0,"Claire, a savvy venture capitalist from New York City, escapes to a quaint town in Vermont for the holidays and becomes a guest of the Fortenbury Bookstore. Upon arrival, Claire finds ...                See full summary »",Movie,TV-PG,90.0,6.6,"Comedy, Drama, Romance",Megan Follows,"Alexandra Breckenridge, Jamie Spilchuk, Jane Alexander, Tara Spencer-Nairn, ",
A Christmas Princess,2019.0,"Jessica is a struggling chef living in a trendy New York borough. Prince Jack, who's in the city for his family's annual Christmas charity dinner, finds himself in need of a last-minute chef for a royal event when he meets Jessica.",Movie,TV-PG,90.0,5.5,"Comedy, Romance",Fred Olen Ray,"Shein Mompremier, Travis Burns, Erin Gray, Andy Lauer, ",
Magic Stocking,2015.0,"A young widow's daughter is given a tattered old Christmas stocking at a holiday craft sale, but her mother is skeptical of its magic when it seems to create small trinkets on its own.",Movie,AL,86.0,6.4,"Comedy, Drama, Fantasy",David Winning,"Bridget Regan, Victor Webster, Iris Quinn, Imogen Tear, ",
The Spruces and the Pines,2017.0,Julie (Jonna Walsh) and Rick (Nick Ballard) fall in love despite being on opposite sides of feuding Christmas-tree-farm families.,Movie,Unrated,86.0,6.0,"Comedy, Drama, Family",John Stimpson,"Jonna Walsh, Nick Ballard, Tom Kemp, Ken Cheeseman, ",
Magical Christmas Ornaments,2017.0,"""After a bad breakup, former Christmas lover Marie (Lowndes) loses her Christmas spirit. Trying to restore it, her mother sends Marie Christmas ornaments from her childhood, and a ...                See full summary »",Movie,TV-14,90.0,6.3,"Drama, Fantasy, Romance",Don McBrearty,"Jessica Lowndes, Brendan Penny, Farah Merani, Stephen Huszar, ",
Four Christmases and a Wedding,2017.0,"Chloe plans the first Christmas Fair where she meets Evan and falls in love, but he goes to Norway for his dream job. He bring someone else to the second one; during the third one, Chloe is dating Ted. What will happen this year?",Movie,TV-14,90.0,5.9,"Comedy, Drama, Family",Marita Grabiak,"Arielle Kebbel, Corey Sevier, Markie Post, Madison Smith, ",
