title,release_year,description,type,rating,runtime,imdb_rating,genre,director,stars,gross
"Nativity 3: Dude, Where's My Donkey?!",2014.0,"The pupils of St Bernadette's and the madcap Mr Poppy (MARC WOOTTON) are back! When their new teacher Mr Shepherd (MARTIN CLUNES) loses his memory as well as Archie the Donkey, it's up to ...                See full summary »",Movie,,109.0,3.6,"Comedy, Family",Debbie Isitt,"Martin Clunes, Marc Wootton, Catherine Tate, Adam Garcia, ",
Nativity Rocks!,2018.0,The staff and students of St Bernadette's Primary School in Coventry audition for a place in a rock-musical competition.,Movie,,100.0,4.3,"Comedy, Family, Musical",Debbie Isitt,"Simon Lipkin, Craig Revel Horwood, Daniel Boys, Anna Chancellor, ",
12 Gifts of Christmas,2015.0,"With just two weeks left until Christmas, a busy marketing executive hires a struggling artist-turned-personal shopper to help him buy gifts for his friends and family.",Movie,TV-G,83.0,6.3,"Comedy, Romance",Peter Sullivan,"Katrina Law, Aaron O'Connell, Donna Mills, Melanie Nelson, ",
Godmothered,2020.0,An unskilled young fairy godmother ventures out on her own to prove her worth by tracking down a young girl whose request for help was ignored.,Movie,PG,110.0,6.1,"Comedy, Drama, Family",Sharon Maguire,"June Squibb, Jillian Bell, Sonia Manzano, Carlease Burke, ",
Crown Prince of Christmas,2022.0,"Madison, a musician, jokingly says she is dating the prince of a small European nation. Her friend Sebastian is roped into impersonating the prince while visiting her family.",Movie,,85.0,5.2,"Comedy, Drama, Romance",Anthony C. Ferrante,"Cindy Busby, Jilon VanOver, Nancy Harding, Jeff K. Kim, ",
Blackadder's Christmas Carol,1988.0,"After a genial spirit shows the benevolent Ebenezer Blackadder visions of his unscrupulous ancestors, he resolves to mend his generous ways.",Movie,,43.0,7.9,"Comedy, History",Richard Boden,"Rowan Atkinson, Tony Robinson, Miranda Richardson, Stephen Fry, ",
Rudolph the Red-Nosed Reindeer: The Movie,1998.0,It's up to Santa's most famous reindeer to save the day when an evil queen conjures up a storm on Christmas.,Movie,G,83.0,5.8,"Animation, Adventure, Family",William R. Kowalchuk Jr.,"John Goodman, Bob Newhart, Debbie Reynolds, Eric Pospisil, ",$0.11M
The Thin Man,1934.0,"Former detective Nick Charles and his wealthy wife Nora investigate a murder case, mostly for the fun of it.",Movie,TV-PG,91.0,7.9,"Comedy, Crime, Mystery",W.S. Van Dyke,"William Powell, Myrna Loy, Maureen O'Sullivan, Nat Pendleton, ",
Christmas Wedding Planner,2017.0,"While planning her cousin's lavish wedding, Kelsey Wilson's world is turned upside down when Private Investigator Connor McClean shows up. Connor, hired by a unnamed source, disrupts the upcoming nuptials but manages to win Kelsey's heart.",Movie,PG,86.0,4.4,Romance,Justin G. Dyck,"Jocelyn Hudon, Stephen Huszar, Kelly Rutherford, Rebecca Dalton, ",
Tokyo Godfathers,2003.0,"On Christmas Eve, three homeless people living on the streets of Tokyo discover a newborn baby among the trash and set out to find its parents.",Movie,PG-13,92.0,7.8,"Animation, Adventure, Comedy",Satoshi Kon,"Tôru Emori, Yoshiaki Umegaki, Aya Okamoto, Shôzô Îzuka, ",$0.13M
The Christmas Shoes,2002.0,"A young boy tries to get a pair of Christmas shoes for his dying mother, while a lawyer tries to deal with the break-up of his marriage.",Movie,TV-PG,100.0,6.6,"Drama, Family",Andy Wolk,"Rob Lowe, Kimberly Williams-Paisley, Max Morrow, Maria del Mar, ",
All I Didn't Want for Christmas,2022.0,"Emily Harris is not doing great. In a desperate attempt to improve her life and make this Christmas not totally suck, Emily writes a letter to Santa. Fortunately, and unfortunately, her wine-soaked wishes start coming true.",Movie,,89.0,6.2,"Comedy, Romance",Brittany Scott Smith,"Darrin Baker, Andrew Bushell, Eugene Clark, Jessica Clement, ",
Debbie Macomber's Dashing Through the Snow,2015.0,"Stranded at an airport at Christmastime, Ashley Jane Harrison accepts a ride from Dash Sutherland, who has just rented the last car in town. As the pair heads north, their adventures include car trouble.",Movie,Not Rated,83.0,6.5,"Comedy, Family, Romance",Kristoffer Tabori,"Meghan Ory, Andrew W. Walker, Aaron Craven, Rukiya Bernard, ",
The Little Drummer Boy,1968.0,An orphan drummer boy who hates humanity finds his life changed forever when he meets three wise men en route to Bethlehem.,Movie,Not Rated,25.0,7.0,"Animation, Drama, Family",Jules Bass,"Arthur Rankin Jr., Takeya Nakamura, José Ferrer, Paul Frees, June Foray, Ted Eccles, ",
The Most Wonderful Time of the Year,2008.0,"Corporate analyst and single mom, Jen, tackles Christmas with a business-like approach until her uncle arrives with a handsome stranger in tow.",Movie,TV-PG,88.0,7.3,"Comedy, Drama, Family",Michael M. Scott,"Brooke Burns, Henry Winkler, Warren Christie, Connor Christopher Levins, ",
March of the Wooden Soldiers,1934.0,"Opposing the evil Barnaby, Ollie Dee and Stanley Dum try and fail to pay-off Mother Peep's mortgage and mislead his attempts to marry Little Bo. Enraged, Barnaby's Bogeymen are set on Toyland.",Movie,Passed,77.0,7.1,"Comedy, Family, Fantasy",Gus Meins,"Charley Rogers, Stan Laurel, Oliver Hardy, Virginia Karns, Charlotte Henry, ",
Christmas at Castle Hart,2021.0,"Brooke Bennett goes to Ireland for Christmas to search for her Irish roots. While there, she meets Aiden Hart. Mistaken for an elite event planner, she's hired to host his castle's epic Christmas party.",Movie,TV-G,84.0,6.3,"Comedy, Romance",Stefan Scaini,"Lacey Chabert, Stuart Townsend, Ali Hardiman, Kate O'Toole, ",
A Christmas Carol: The Musical,2004.0,An old bitter miser is given a chance for redemption when he is haunted by ghosts on Christmas Eve.,Movie,Not Rated,97.0,6.3,"Drama, Fantasy, Musical",Arthur Allan Seidelman,"Kelsey Grammer, Jesse L. Martin, Jane Krakowski, Jennifer Love Hewitt, ",
A Taste of Christmas,2020.0,"When Natalie learns her cousin Francesca must cancel the Christmas Eve opening of her new Italian restaurant, Natalie's heart goes out to all of the guests who were planning on attending.",Movie,TV-PG,91.0,5.6,"Comedy, Romance",Damián Romay,"Anni Krueger, Gilles Marini, Nia Vardalos, Emma Myers, ",
Family for Christmas,2015.0,"After a conversation with a man playing Santa Claus during her office Christmas party, a woman wakes up to find herself married to her college sweetheart and two kids and questions her life choices.",Movie,TV-G,82.0,6.2,"Drama, Family, Fantasy",Amanda Tapping,"Lacey Chabert, Tyron Leitso, Milli Wilkinson, Audrey Smallman, ",
Christmas Reservations,2019.0,"It's Christmas at the Treeline Ski Resort, where Holly is the event coordinator at her family lodge. She plans every event and keeps all the guests happy. But when her college sweetheart, ...                See full summary »",Movie,TV-PG,86.0,6.0,"Comedy, Drama, Romance",Deanne Foley,"Melissa Joan Hart, Michael Gross, Christopher Quartuccio, Gigi Rice, ",
Three Wishes for Cinderella,1973.0,Life changes dramatically for a Czech housemaid when the chauffeur gives her three magical hazelnuts.,Movie,,75.0,7.7,"Drama, Fantasy, Family",Václav Vorlícek,"Libuse Safránková, Pavel Trávnícek, Carola Braunbock, Rolf Hoppe, ",
Charlotte's Web,2006.0,"Wilbur the pig is scared of the end of the season, because he knows that come that time, he will end up on the dinner table. He hatches a plan with Charlotte, a spider that lives in his pen, to ensure that this will never happen.",Movie,G,97.0,6.3,"Adventure, Comedy, Family",Gary Winick,"Dakota Fanning, Julia Roberts, Oprah Winfrey, Steve Buscemi, ",$82.99M
The Christmas Card,2006.0,US soldier visits the town from where an inspirational Christmas card was sent to him by a church group that mails cards out to servicemen as a goodwill effort.,Movie,,84.0,6.9,"Drama, Romance",Stephen Bridgewater,"Edward Asner, John Newton, Alice Evans, Lois Nettleton, ",
Coming Home for Christmas,2017.0,"Lizzie Richfield lands a job as house manager for the exquisite Ashford Estate in Virginia. While preparing the place for sale, Lizzie plans one final Christmas Eve gala for the Marley family, though they seem to be a family in name only.",Movie,TV-G,86.0,6.6,"Drama, Romance",Mel Damski,"Danica McKellar, Neal Bledsoe, Andrew Francis, Lindsay Maxwell, ",
A Christmas Movie Christmas,2019.0,"Following a Christmas Eve wish to Santa, two sisters wake up inside a Christmas movie.",Movie,Unrated,85.0,5.6,"Comedy, Fantasy, Romance",Brian Herzlinger,"Brant Daugherty, Lana McKissack, Kimberly Daugherty, Ryan Merriman, ",
A Cinderella Christmas,2016.0,"After a wealthy celebrity falls in love with a mystery woman at his Christmas masquerade ball, he attempts to discover her true identity.",Movie,Unrated,93.0,6.2,"Comedy, Romance",Tosca Musk,"Emma Catherine Rigby, Peter Porte, Sarah Stouffer, Leland B. Martin, ",
Noel,2004.0,"Five New Yorkers come together on Christmas Eve, seeking a miracle.",Movie,PG,96.0,6.1,Drama,Chazz Palminteri,"Susan Sarandon, Penélope Cruz, Paul Walker, Alan Arkin, ",
I'm Glad It's Christmas,2022.0,"Cora does everything to bring together Holly, a salesclerk who dreams of performing on Broadway, and Jason, a jingle writer and single father, for the town's holiday concert.",Movie,,85.0,6.7,"Comedy, Drama, Family",Ernie Barbarash,"Jessica Lowndes, Paul Greene, Gladys Knight, Sierra Wooldridge, ",
Christmas on the Square,2020.0,"An embittered scrooge of a woman plans to sell her small town, regardless of the consequences to the people who live there. However, a kindhearted angel arrives and shows her what would happen before she mends her ways and redeems herself.",Movie,TV-PG,98.0,5.2,"Comedy, Family, Musical",Debbie Allen,"Dolly Parton, Jenifer Lewis, Josh Segarra, Jeanine Mason, ",
Mrs. Miracle,2009.0,"Overwhelmed widower Seth Webster is searching for a housekeeper to help him with his unruly six year old twin sons. ""Mrs. Miracle"" mysteriously appears and quickly becomes an irreplaceable nanny, chef, friend... and matchmaker.",Movie,Not Rated,90.0,6.6,"Comedy, Family, Fantasy",Michael M. Scott,"James Van Der Beek, Erin Karpluk, Doris Roberts, Michael Strusievici, ",
Feast of the Seven Fishes,2019.0,"A slice of life story that follows a large Italian family on Christmas Eve as they prepare for the traditional Feast of the Seven Fishes, reminisce about the past, and seek love in the future.",Movie,,99.0,6.7,Comedy,Robert Tinnell,"Tony Bingham, Skyler Gisondo, Paul Ben-Victor, Jean Zarzour, ",
"Love, Lights, Hanukkah!",2020.0,"As Christina prepares her restaurant for its busiest time of year, she gets her DNA test revealing that she's Jewish. The discovery leads her to a new family and an unlikely romance over eight nights.",Movie,TV-G,84.0,6.8,"Drama, Romance",Mark Jean,"Mia Kirshner, Ben Savage, Marilu Henner, Advah Soudack, ",
Cover Up,1949.0,"An insurance company investigator goes to a small town to probe into a case of supposed suicide. The natives are not very cooperative and some turn hostile, leading to suspicion of foul play.",Movie,TV-14,83.0,6.6,"Film-Noir, Mystery",Alfred E. Green,"William Bendix, Dennis O'Keefe, Barbara Britton, Art Baker, ",
Hometown Holiday,2018.0,"Krista is starting this New Year with a new business and a resolution to be more selective with who she dates. When Krista meets Ryan Rourke, an entertainment lawyer from LA, the two really...                See full summary »",Movie,TV-PG,84.0,5.1,"Comedy, Drama, Romance",Justin G. Dyck,"Sarah Troyer, Bradley Hamilton, Kevin McGarry, Samantha Gracie, ",
Scrooge,1935.0,"Scrooge is mean old miser who wants nothing to do with Christmas. The Ghosts of Christmas Past, Present and Future appear to Scrooge, taking him on a journey into the very spirit and magic of Christmas itself.",Movie,,78.0,6.5,"Drama, Family, Fantasy",Henry Edwards,"Seymour Hicks, Donald Calthrop, Robert Cochran, Mary Glynne, ",
In the Good Old Summertime,1949.0,"In turn-of-the century America, Andrew and Veronica are co-workers in a music shop who dislike one another during business hours but unwittingly carry on an anonymous romance through the mail.",Movie,Approved,102.0,7.1,"Comedy, Musical, Romance",Robert Z. Leonard,"Judy Garland, Van Johnson, S.Z. Sakall, Spring Byington, ",$6.30M
Reindeer Games Homecoming,2022.0,"When her father dies, MacKenzie keeps her father's tradition of the town's fundraising ""The Reindeer Games"" alive, but when high school crush Chase shows up and plays against her, the spark between them grows.",Movie,TV-PG,90.0,7.0,"Comedy, Drama, Romance",Brian Herzlinger,"Sarah Drew, Justin Bruening, Brian Sills, Ava Cheung, ",
Jingle Bell Princess,2021.0,"Through a series of mishaps, sophisticated Princess Amelia is stranded in the small town of Tucker, Maine. There she becomes an ""ordinary"" guest of the unsuspecting Cutler family.",Movie,7+,90.0,6.5,Romance,Don McBrearty,"Merritt Patterson, Trevor Donovan, Charlie Boyle, Marnie McPhail, ",
Christmas in Evergreen,2017.0,"Hoping to spur her longtime beau to action, a small-town veterinarian wishes upon a snow globe that this will be her most romantic Christmas ever.",Movie,TV-G,84.0,6.5,"Drama, Family, Fantasy",Alex Zamm,"Ashley Williams, Teddy Sears, Holly Robinson Peete, Jaeda Lily Miller, ",
Kirk Cameron's Saving Christmas,2014.0,"His annual Christmas party faltering thanks to his cynical brother-in-law, former Growing Pains star Kirk Cameron attempts to save the day by showing him that Jesus Christ remains a crucial component of the over-commercialized holiday..",Movie,PG,79.0,1.3,"Comedy, Family",Darren Doane,"Kirk Cameron, Darren Doane, Bridgette Cameron, Ben Kientz, ",$2.78M
Merry Swissmas,2022.0,"When Alex returns home to spend Christmas with her mother, she discovers that her ex-boyfriend and her best friend, who are now dating, are also visiting.",Movie,TV-PG,88.0,5.4,"Comedy, Drama, Romance",John L'Ecuyer,"Jodie Sweetin, Tim Rozon, Amanda Ip, Alison Brooks, ",
The Christmas House,2020.0,"Working through some difficult decisions, a mother and father summon their two grown sons home for the holidays.",Movie,TV-G,84.0,6.0,"Drama, Romance",Michael Grossman,"Robert Buckley, Ana Ayora, Treat Williams, Sharon Lawrence, ",
One Christmas Eve,2014.0,"A series of mishaps threaten a recently divorced mom's attempts to make her two kids' first Christmas ""without dad"" perfect.",Movie,Not Rated,86.0,6.0,"Comedy, Drama, Family",Jay Russell,"Anne Heche, Kevin Daniels, Carlos Gómez, Griffin Kane, ",
Christmas Again,2021.0,"After a disastrous celebration, 12-year-old Rowena makes a wish and unexpectedly finds herself reliving Christmas Day over and over again.",Movie,AL,94.0,5.2,"Adventure, Comedy, Family",Andy Fickman,"Scarlett Estevez, Alexis Carra, Beth Lacke, Ashlyn Jade Lopez, ",
Small Town Christmas,2018.0,A high-flying female novelist from New York takes a trip to the small town that inspired her latest best-seller.,Movie,TV-G,85.0,6.7,"Comedy, Drama, Romance",Maclain Nelson,"Ashley Newbrough, Kristoffer Polaha, Preston Vanderslice, Bailey Skodje, ",
Holiday in Santa Fe,2021.0,Sparks fly when a greeting card executive arrives in Santa Fe to acquire a tight-knit family company that creates ornaments inspired by Mexican Christmas traditions.,Movie,AL,85.0,6.1,"Comedy, Drama, Family",Jody Margolin Hahn,"Mario Lopez, Emeraude Toubia, Aimee Garcia, Gia Lopez, ",
The Sweetest Christmas,2017.0,"Kylie is expecting a proposal from her boyfriend/boss at a restaurant and gets a promotion instead. The restaurant owner is her old high school boyfriend, she hasn't seen in years. They help each other out. Love in the air?",Movie,TV-G,90.0,6.3,"Comedy, Drama, Romance",Terry Ingram,"Lacey Chabert, Lea Coco, Jonathan Adams, Brenden Sunderland, ",
Dear Christmas,2020.0,"Natalie has a hit podcast based on love, but she isn't so expert at finding it herself until Chris Massey enters her life and shakes things up. Not to mention his name.",Movie,TV-G,86.0,6.0,"Comedy, Drama, Romance",Emily Moss Wilson,"Melissa Joan Hart, Ed Begley Jr., Faith Prince, Nicky Whelan, ",
One Royal Holiday,2020.0,"When Anna offers a stranded mother and son shelter in a blizzard, she learns that they are the Royal Family of Galwick. Anna shows the Prince how they do Christmas in her hometown, encouraging him to open his heart and be true to himself.",Movie,TV-G,87.0,7.0,"Comedy, Drama, Family",Dustin Rikert,"Laura Osnes, Krystal Joy Brown, Tom McGowan, Bradley Rose, ",
Barbie in the Nutcracker,2001.0,"Barbie (Kelly Sheridan) shows that if you are kind, clever and brave, anything is possible in this tale of Clara (Kelly Sheridan) and her amazing Nutcracker (Kirby Morrow), who set off on an adventure to find the Sugarplum Princess.",Movie,TV-Y,76.0,6.3,"Animation, Family, Musical",Owen Hurley,"Kelly Sheridan, Kirby Morrow, Tim Curry, Peter Kelamis, ",
Anne of Green Gables,1985.0,"An orphan girl, sent to an elderly brother and sister by mistake, charms her new home and community with her fiery spirit and imagination.",Movie,TV-G,199.0,8.5,"Drama, Family",Megan Follows,"Colleen Dewhurst, Richard Farnsworth, Patricia Hamilton, ",
Christmas at the Plaza,2019.0,An archival historian is hired to create a Christmas display at the Plaza Hotel and is paired with a handsome Christmas decorator to bring it to life.,Movie,TV-G,84.0,6.5,"Drama, Romance",Ron Oliver,"Elizabeth Henstridge, Ryan Paevey, Bruce Davison, Julia Duffy, ",
The Mistle-Tones,2012.0,A talented singer forms a musical group and challenges her rivals to a competition on Christmas Eve.,Movie,TV-PG,90.0,6.4,"Comedy, Family, Music",Paul Hoen,"Tia Mowry-Hardrict, Jonathan Patrick Moore, Andy Gala, Megan Kathleen Duffy, ",
A Christmas Prince: The Royal Wedding,2018.0,"A year after helping Richard get to the throne, Amber is about to become his wife. But is she really made to be queen?",Movie,TV-PG,92.0,5.3,"Drama, Romance",John Schultz,"Rose McIver, Ben Lamb, Alice Krige, Honor Kneafsey, ",
A Timeless Christmas,2020.0,Charles Whitley travels from 1903 to 2020 where he meets Megan Turner and experiences a 21st Century Christmas.,Movie,TV-G,84.0,7.0,"Comedy, Fantasy, Romance",Ron Oliver,"Erin Cahill, Ryan Paevey, Brandi Alexander, Zahf Paroo, ",
Bachelor Mother,1939.0,"An unemployed woman discovers an abandoned baby on the steps of an orphanage, and accepts an offer to take responsibility for the child in return for a job.",Movie,Passed,82.0,7.5,"Comedy, Romance",Garson Kanin,"Ginger Rogers, David Niven, Charles Coburn, Frank Albertson, ",
Christmas in the Smokies,2015.0,Christmas in the Smokies is a modern-day Christmas classic set in the beautiful Smoky Mountains that tells the story of one family's journey to save their historic berry farm against all odds during one fateful holiday season.,Movie,TV-G,88.0,5.8,"Drama, Family, Romance",Gary Wheeler,"Sarah Lancaster, Barry Corbin, Alan Powell, Jill Wagner, ",
Christmas at the Palace,2018.0,A king who is struggling to live up to his father's name hires an ice skating choreographer for a special Christmas Eve performance to celebrate the founding of his nation.,Movie,TV-G,85.0,6.3,Romance,Peter Hewitt,"Merritt Patterson, Andrew Cooper, Brittany Bristow, Nicholas Banks, ",
The Christmas List,1997.0,Perfume saleslady Melody Parris feels like her life is in neutral. Her stick-in-the mud boyfriend won't commit and she gets passed over for a promotion at the store where she works. She ...                See full summary »,Movie,,96.0,6.7,"Comedy, Fantasy, Romance",Charles Jarrott,"Mimi Rogers, Rob Stewart, Stella Stevens, Bill Switzer, ",
A New Orleans Noel,2022.0,"Follows Grace and Anthony, who despite having gone to college to study architecture together, are too different, but things between them change after both are hired to work on the same place and end up celebrating Christmas together.",Movie,TV-PG,85.0,5.9,Drama,Angela Tucker,"Tim Reid, Keshia Knight Pulliam, Brad James, Patti LaBelle, ",
Rocky Mountain Christmas,2017.0,"After her breakup with a famous tech entrepreneur makes national headlines, Sarah returns to her uncle's ranch to escape the spotlight where she crosses paths with a Hollywood actor who's looking to prepare for an upcoming role.",Movie,TV-G,90.0,6.5,"Family, Fantasy, Romance",Tibor Takács,"Kristoffer Polaha, Lindy Booth, Treat Williams, Chris McNally, ",
Christmas Plus One,2022.0,"When sisters Cara and Amy make a pact to find their soulmates by next Christmas, they're not expecting to be so lucky. One year later, Amy's wedding approaches and Cara finds her soulmate but quickly loses him. Will her wish come true?",Movie,,92.0,6.1,"Comedy, Romance",Meeshelle Neal,"Emily Alatalo, Corey Sevier, Andrew Bushell, Leighton Alexander Williams, ",
How to Ruin Christmas,2020.0,Prodigal daughter Tumi goes home for the holidays and manages to ruin her sister's wedding plans. Now she must make things right before it's too late.,Movie,TV-MA,50.0,6.4,"Comedy, Drama",Saint Seseli,"Nandi Nyembe, Busisiwe Lurayi, Thando Thabethe, ",
Lady on a Train,1945.0,"In New York, a woman who partially witnesses a killing from a train window seeks the aid of a crime novelist to solve the murder.",Movie,Passed,94.0,6.8,"Comedy, Crime, Film-Noir",Charles David,"Deanna Durbin, Ralph Bellamy, David Bruce, George Coulouris, ",
Christmas Ransom,2022.0,"When a pair of bumbling crooks hijack the Harrington and Sons toy store, a pair of kids stumble into the heist and are forced to team up with a female security officer to save Christmas.",Movie,,84.0,4.7,"Adventure, Comedy, Family",Adele Vuko,"Noah Atkinson, Vivienne Awosoga, Luc Barrett, Hugo Driscoll, ",
A Veteran's Christmas,2018.0,"After receiving an honorable discharge, a former Marine suffers a minor car accident which strands her in a small town for the Christmas season.",Movie,TV-G,84.0,6.9,"Drama, Romance",Mark Jean,"Sean Faris, Eloise Mumford, Mary Long, Amanda Lisman, ",
The Mistletoe Promise,2016.0,Two self-confessed 'Christmasphobes' sign a contract which will mutually benefit them over the holiday season.,Movie,TV-G,84.0,6.6,"Comedy, Drama, Family",David Winning,"Jaime King, Luke Macfarlane, Christie Laing, Lochlyn Munro, ",
A Bride for Christmas,2012.0,A single man tries to win a bet by getting a woman recovering from a broken engagement to marry him by Christmas.,Movie,TV-G,84.0,6.5,"Comedy, Romance",Gary Yates,"Arielle Kebbel, Andrew W. Walker, Kimberley Sustad, Sage Brocklebank, ",
The Christmas Setup,2020.0,"As they enjoy the local holidays together, Hugo and Patrick's attraction to each other is undeniable but as Hugo receives word of a big promotion requiring a move to London, he must decide what is most important to him.",Movie,TV-PG,85.0,6.8,"Drama, Romance",Pat Mills,"Ben Lewis, Blake Lee, Fran Drescher, Ellen Wong, ",
A Season for Miracles,1999.0,A miracle occurs for a homeless family consisting of two children neglected by their incarcerated mother and their protective aunt who is trying to keep them out of the foster system with the help of an angel.,Movie,G,100.0,7.6,"Drama, Romance",Michael Pressman,"Carla Gugino, Kathy Baker, David Conrad, Laura Dern, ",
The Christmas Miracle of Jonathan Toomey,2007.0,"When a broken hearted boy loses the treasured wooden nativity set that links him to his dead father, his worried mother persuades a lonely ill-tempered woodcarver to create a replacement, ...                See full summary »",Movie,6,91.0,6.4,Family,Bill Clark,"Tom Berenger, Sarah Wildor, Thomas Briggs, Joely Richardson, ",
Silent Night,2002.0,"In a cabin in a WWII front, a German mom with a son mediates a truce between 3 German and 3 American soldiers so they can all celebrate Christmas Eve 1944 together.",Movie,TV-PG,100.0,7.5,"Biography, Drama, War",Rodney Gibbons,"Linda Hamilton, Matthew Harbour, Romano Orzari, Alain Goulem, ",
A Christmas Love Story,2019.0,"A youth choir director (Chenoweth) needs to write a big song for the Christmas Eve show but ""finds herself distracted"" when a boy with a golden voice (Kevin Quinn) joins her choir, which will come as news to his widowed father (Wolf).",Movie,TV-G,84.0,6.9,"Drama, Music, Romance",Eric Close,"Kristin Chenoweth, Scott Wolf, Kevin Quinn, Keith D. Robinson, ",
A Shoe Addict's Christmas,2018.0,Noelle's life stopped when her boyfriend broke up with her on Christmas Eve three years ago. A handsome fireman moves in above her. She gets locked in at work in a department store all alone save the ghost of Christmas past.,Movie,TV-G,85.0,6.5,"Fantasy, Romance",Michael Robison,"Candace Cameron Bure, Luke Macfarlane, Jean Smart, Tenika Davis, ",
The Christmas Cottage,2017.0,"While helping to organize her best friend's Christmas wedding, a successful designer reconnects with an old flame.",Movie,TV-G,90.0,6.3,"Comedy, Drama, Romance",Paul A. Kaufman,"Merritt Patterson, Steve Lund, Brittney Wilson, Victor Zinck Jr., ",
Call Me Mrs. Miracle,2010.0,A family-owned department store is struggling to sell toys during the holidays when a mysterious employee shows up and begins to work miracles.,Movie,Not Rated,90.0,6.8,"Comedy, Drama, Family",Michael M. Scott,"Doris Roberts, Jewel Staite, Eric Johnson, Quinn Lord, ",
A Royal Christmas,2014.0,"Prince Leopold, heir to the throne of Cordinia, wishes to marry his young love Emily Taylor, a humble seamstress from Philadelphia. But Leopold's mother, Queen Isadora has other plans for her son.",Movie,TV-G,90.0,6.5,"Comedy, Family, Romance",Alex Zamm,"Lacey Chabert, Jane Seymour, Stephen Hagan, Katherine Flynn, ",
Scentsational Christmas,2022.0,"Ellie decides to go back home for Christmas, and help her dad with the candle-making business. Little does she know, however, that her father has charming, writer Logan staying with him, looking for inspiration for his writings.",Movie,TV-PG,85.0,5.3,"Family, Romance",Robert Vaughn,"Nazneen Contractor, Mykee Selkin, Sugith Varughese, Jennifer Gibson, ",
